esrs,dr,paragraph,name,datatype,appendix,voluntary
E1, E1.IRO-1 ,AR 11d,Identification of climate-related hazards and assessment of exposure and sensitivity are informed by high emissions climate scenarios,semi-narrative,,,
E1, E1.IRO-1 ,21,"Explanation of how climate-related scenario analysis has been used to inform identification and assessment of physical risks over short, medium and long-term ",narrative,,,
E1, E1.IRO-1 ,20c,Description of process in relation to climate-related transition risks and opportunities in own operations and along value chain ,narrative,,,
E1, E1.IRO-1 ,AR 12a,"Transition events have been identified over short-, medium- and long-term time horizons",semi-narrative,,,
E1, E1.IRO-1 ,AR 12a,Undertaking has screened whether assets and business activities may be exposed to transition events,semi-narrative,,,
E1, E1.IRO-1 ,AR 12b,Extent to which assets and business activities may be exposed and are sensitive to identified transition events has been assessed,semi-narrative,,,
E1, E1.IRO-1 ,AR 12c,Identification of transition events and assessment of exposure has been informed by climate-related scenario analysis,semi-narrative,,,
E1, E1.IRO-1 ,AR 12d,Assets and business activities that are incompatible with or need significant efforts to be compatible with transition to climate-neutral economy have been identified,semi-narrative,,,
E1, E1.IRO-1 ,21,"Explanation of how climate-related scenario analysis has been used to inform identification and assessment of transition risks and opportunities over short, medium and long-term ",narrative,,,
E1, E1.IRO-1 ,AR 15,Explanation of how climate scenarios used are compatible with critical climate-related assumptions made in financial statements ,narrative,,,
